{
  "schema_version": "1.0",
  "id": "ec2-tag-pivot",
  "expect": "matched",
  "intent_nl": "For each AWS EC2 instance in the list, pivot its Tags array (a list of {Key,Value}) into an object with name, environment and team fields, using null when a given tag is absent.",
  "samples": {
    "schema_version": "1.0",
    "intent_nl": "For each AWS EC2 instance in the list, pivot its Tags array (a list of {Key,Value}) into an object with name, environment and team fields, using null when a given tag is absent.",
    "coverage": [
      {
        "id": "ob-happy",
        "kind": "happy_path",
        "description": "Instances with full tags pivot to name/environment/team.",
        "acceptance": "accepted"
      },
      {
        "id": "ob-null",
        "kind": "custom",
        "description": "An instance missing the Team tag yields team = null.",
        "acceptance": "accepted"
      },
      {
        "id": "ob-empty",
        "kind": "custom",
        "description": "An empty instance list yields an empty list.",
        "acceptance": "accepted"
      }
    ],
    "cases": [
      {
        "id": "c-list",
        "input": [
          {
            "InstanceId": "i-0abcd1234efgh5678",
            "InstanceType": "t3.large",
            "State": {
              "Name": "running"
            },
            "PrivateIpAddress": "10.0.3.14",
            "PublicIpAddress": "54.221.10.99",
            "VpcId": "vpc-0123456789abcdef0",
            "Placement": {
              "AvailabilityZone": "us-east-1a"
            },
            "BlockDeviceMappings": [
              {
                "Ebs": {
                  "VolumeId": "vol-0a1b2c3d4e5f60718"
                }
              },
              {
                "Ebs": {
                  "VolumeId": "vol-08192a3b4c5d6e7f8"
                }
              }
            ],
            "Tags": [
              {
                "Key": "Name",
                "Value": "web-prod-01"
              },
              {
                "Key": "Environment",
                "Value": "production"
              },
              {
                "Key": "Team",
                "Value": "platform"
              }
            ]
          },
          {
            "InstanceId": "i-0ffff1111eeee2222",
            "InstanceType": "t3.micro",
            "State": {
              "Name": "stopped"
            },
            "PrivateIpAddress": "10.0.3.51",
            "VpcId": "vpc-0123456789abcdef0",
            "Placement": {
              "AvailabilityZone": "us-east-1a"
            },
            "BlockDeviceMappings": [
              {
                "Ebs": {
                  "VolumeId": "vol-0aaa1bbb2ccc3ddd4"
                }
              }
            ],
            "Tags": [
              {
                "Key": "Name",
                "Value": "batch-worker-07"
              },
              {
                "Key": "Environment",
                "Value": "staging"
              }
            ]
          }
        ],
        "output": [
          {
            "name": "web-prod-01",
            "environment": "production",
            "team": "platform"
          },
          {
            "name": "batch-worker-07",
            "environment": "staging",
            "team": null
          }
        ],
        "satisfies": [
          "ob-happy",
          "ob-null"
        ]
      },
      {
        "id": "c-empty",
        "input": [],
        "output": [],
        "satisfies": [
          "ob-empty"
        ]
      }
    ],
    "waivers": [],
    "confirmation": {
      "confirmed": true,
      "confirmed_by": "ci",
      "content_fingerprint": "89db26273679dff7baccd7c86608791398fc90c4a44a1bd5ce18c874f05e4875"
    }
  },
  "redacted": false
}
