{
  "schema_version": "1.0",
  "id": "syn-convert-value",
  "expect": "matched",
  "intent_nl": "Take an input integer, add 100 to it, and return the sum as a string.",
  "samples": {
    "schema_version": "1.0",
    "intent_nl": "Take an input integer, add 100 to it, and return the sum as a string.",
    "coverage": [
      {
        "id": "ob-happy",
        "kind": "happy_path",
        "description": "Happy path: the corpus example's own data/result pair re-executed through the pinned engine (AD-021 corpus pair).",
        "acceptance": "accepted"
      },
      {
        "id": "ob-variation-1",
        "kind": "custom",
        "description": "Value variation 1: the corpus data shape with leaf scalars replaced from the fixed per-JSON-type substitution table (FR-029).",
        "acceptance": "accepted"
      },
      {
        "id": "ob-variation-2",
        "kind": "custom",
        "description": "Value variation 2: the corpus data shape with leaf scalars replaced from the fixed per-JSON-type substitution table (FR-029).",
        "acceptance": "accepted"
      }
    ],
    "cases": [
      {
        "id": "c-1",
        "input": 123,
        "output": "223",
        "satisfies": [
          "ob-happy"
        ]
      },
      {
        "id": "c-2",
        "input": 7,
        "output": "107",
        "satisfies": [
          "ob-variation-1"
        ]
      },
      {
        "id": "c-3",
        "input": 11,
        "output": "111",
        "satisfies": [
          "ob-variation-2"
        ]
      }
    ],
    "waivers": [],
    "confirmation": {
      "confirmed": true,
      "confirmed_by": "ci",
      "content_fingerprint": "b5633fe0af3645c559a16b47a45ba79450d3f7ccc061bd4c0f8191d874d66b36"
    }
  },
  "notes": "Synthetic fixture minted from the pinned snapshot docs.examples entry 'ConvertValue' (AD-021 / FR-029); seed provenance at evals/seeds/syn-convert-value.json.",
  "redacted": false
}
