{
  "schema_version": "1.0",
  "id": "github-files-changed",
  "expect": "matched",
  "intent_nl": "From a GitHub push payload, aggregate every file path touched across all commits (added, removed and modified) into one flat filesChanged list, in commit-then-field order.",
  "samples": {
    "schema_version": "1.0",
    "intent_nl": "From a GitHub push payload, aggregate every file path touched across all commits (added, removed and modified) into one flat filesChanged list, in commit-then-field order.",
    "coverage": [
      {
        "id": "ob-happy",
        "kind": "happy_path",
        "description": "Files flattened across commits.",
        "acceptance": "accepted"
      },
      {
        "id": "ob-one",
        "kind": "custom",
        "description": "A single commit's files.",
        "acceptance": "accepted"
      }
    ],
    "cases": [
      {
        "id": "c2",
        "input": {
          "ref": "refs/heads/main",
          "before": "9d8f",
          "after": "1a2b3c4d5e6f",
          "repository": {
            "id": 555000111,
            "name": "payments-api",
            "full_name": "acme/payments-api",
            "default_branch": "main"
          },
          "pusher": {
            "name": "ada",
            "email": "ada@acme.io"
          },
          "sender": {
            "login": "ada",
            "type": "User"
          },
          "commits": [
            {
              "message": "Add idempotency keys to refund endpoint",
              "added": [
                "internal/refund/idempotency.go"
              ],
              "removed": [],
              "modified": [
                "internal/refund/handler.go",
                "internal/refund/handler_test.go"
              ]
            },
            {
              "message": "Fix nil deref when card country is missing",
              "added": [],
              "removed": [],
              "modified": [
                "internal/checkout/validate.go"
              ]
            }
          ]
        },
        "output": {
          "filesChanged": [
            "internal/refund/idempotency.go",
            "internal/refund/handler.go",
            "internal/refund/handler_test.go",
            "internal/checkout/validate.go"
          ]
        },
        "satisfies": [
          "ob-happy"
        ]
      },
      {
        "id": "c1",
        "input": {
          "ref": "refs/heads/main",
          "before": "9d8f",
          "after": "1a2b3c4d5e6f",
          "repository": {
            "id": 555000111,
            "name": "payments-api",
            "full_name": "acme/payments-api",
            "default_branch": "main"
          },
          "pusher": {
            "name": "ada",
            "email": "ada@acme.io"
          },
          "sender": {
            "login": "ada",
            "type": "User"
          },
          "commits": [
            {
              "message": "Add idempotency keys to refund endpoint",
              "added": [
                "internal/refund/idempotency.go"
              ],
              "removed": [],
              "modified": [
                "internal/refund/handler.go",
                "internal/refund/handler_test.go"
              ]
            }
          ]
        },
        "output": {
          "filesChanged": [
            "internal/refund/idempotency.go",
            "internal/refund/handler.go",
            "internal/refund/handler_test.go"
          ]
        },
        "satisfies": [
          "ob-one"
        ]
      }
    ],
    "waivers": [],
    "confirmation": {
      "confirmed": true,
      "confirmed_by": "ci",
      "content_fingerprint": "386ce8a152ead1c99859b1553b4565cc3556e8039e526d277842927fc795d9f8"
    }
  },
  "redacted": false
}
