{
  "schema_version": "1.0",
  "id": "syn-join-many-dynamic-dicts",
  "expect": "matched",
  "intent_nl": "Each input item has a \"key\" and a \"value\" field. Build one object that contains both the forward mapping (each key to its value) and the reverse mapping (each value to its key) for every item.",
  "samples": {
    "schema_version": "1.0",
    "intent_nl": "Each input item has a \"key\" and a \"value\" field. Build one object that contains both the forward mapping (each key to its value) and the reverse mapping (each value to its key) for every item.",
    "coverage": [
      {
        "id": "ob-happy",
        "kind": "happy_path",
        "description": "Happy path: the corpus example's own data/result pair re-executed through the pinned engine (AD-021 corpus pair).",
        "acceptance": "accepted"
      },
      {
        "id": "ob-length-variation--root",
        "kind": "custom",
        "description": "Length variation: the corpus array at the document root with its final element removed (OQ-026a).",
        "acceptance": "accepted"
      },
      {
        "id": "ob-variation-1",
        "kind": "custom",
        "description": "Value variation 1: the corpus data shape with leaf scalars replaced from the fixed per-JSON-type substitution table (FR-029).",
        "acceptance": "accepted"
      }
    ],
    "cases": [
      {
        "id": "c-1",
        "input": [
          {
            "key": "a",
            "value": "b"
          },
          {
            "key": "c",
            "value": "d"
          }
        ],
        "output": {
          "a": "b",
          "c": "d",
          "b": "a",
          "d": "c"
        },
        "satisfies": [
          "ob-happy"
        ]
      },
      {
        "id": "c-2",
        "input": [
          {
            "key": "a",
            "value": "b"
          }
        ],
        "output": {
          "a": "b",
          "b": "a"
        },
        "satisfies": [
          "ob-length-variation--root"
        ]
      },
      {
        "id": "c-3",
        "input": [
          {
            "key": "variation-alpha",
            "value": "variation-beta"
          },
          {
            "key": "variation-gamma",
            "value": "variation-alpha"
          }
        ],
        "output": {
          "variation-alpha": "variation-gamma",
          "variation-gamma": "variation-alpha",
          "variation-beta": "variation-alpha"
        },
        "satisfies": [
          "ob-variation-1"
        ]
      }
    ],
    "waivers": [],
    "confirmation": {
      "confirmed": true,
      "confirmed_by": "ci",
      "content_fingerprint": "6b097cf325c105af6558a081f6b0ecd593d0a29f35d600a3acdaee0ca7f1be19"
    }
  },
  "notes": "Synthetic fixture minted from the pinned snapshot docs.examples entry 'JoinManyDynamicDicts' (AD-021 / FR-029); seed provenance at evals/seeds/syn-join-many-dynamic-dicts.json.",
  "redacted": false
}
