{
  "schema_version": "1.0",
  "id": "syn-file-write-via-map",
  "expect": "matched",
  "intent_nl": "For each object in the input list, write it out as its own JSON file named by position: output_0.json, output_1.json, and so on. The transformation result itself should just be an empty list — the file writes are the point.",
  "samples": {
    "schema_version": "1.0",
    "intent_nl": "For each object in the input list, write it out as its own JSON file named by position: output_0.json, output_1.json, and so on. The transformation result itself should just be an empty list — the file writes are the point.",
    "coverage": [
      {
        "id": "ob-happy",
        "kind": "happy_path",
        "description": "Happy path: the corpus example's own data/result pair re-executed through the pinned engine (AD-021 corpus pair).",
        "acceptance": "accepted"
      },
      {
        "id": "ob-writes",
        "kind": "custom",
        "description": "writes: the template is writes-capable; the satisfying case asserts the sandbox-captured writes map (OQ-025e).",
        "acceptance": "accepted"
      },
      {
        "id": "ob-length-variation--root",
        "kind": "custom",
        "description": "Length variation: the corpus array at the document root with its final element removed (OQ-026a).",
        "acceptance": "accepted"
      },
      {
        "id": "ob-variation-1",
        "kind": "custom",
        "description": "Value variation 1: the corpus data shape with leaf scalars replaced from the fixed per-JSON-type substitution table (FR-029).",
        "acceptance": "accepted"
      }
    ],
    "cases": [
      {
        "id": "c-1",
        "input": [
          {
            "id": 1
          },
          {
            "id": 2
          }
        ],
        "output": [],
        "writes": {
          "output_0.json": {
            "id": 1
          },
          "output_1.json": {
            "id": 2
          }
        },
        "satisfies": [
          "ob-happy",
          "ob-writes"
        ]
      },
      {
        "id": "c-2",
        "input": [
          {
            "id": 1
          }
        ],
        "output": [],
        "writes": {
          "output_0.json": {
            "id": 1
          }
        },
        "satisfies": [
          "ob-length-variation--root"
        ]
      },
      {
        "id": "c-3",
        "input": [
          {
            "id": 7
          },
          {
            "id": 11
          }
        ],
        "output": [],
        "writes": {
          "output_0.json": {
            "id": 7
          },
          "output_1.json": {
            "id": 11
          }
        },
        "satisfies": [
          "ob-variation-1"
        ]
      }
    ],
    "waivers": [],
    "confirmation": {
      "confirmed": true,
      "confirmed_by": "ci",
      "content_fingerprint": "9abbb6a696804e63828ab1d71616a01c3de42adb59fc9cb2dd904be2b4bf15aa"
    }
  },
  "notes": "Synthetic fixture minted from the pinned snapshot docs.examples entry 'FileWriteViaMap' (AD-021 / FR-029); seed provenance at evals/seeds/syn-file-write-via-map.json.",
  "redacted": false
}
