{
  "schema_version": "1.0",
  "id": "syn-expr-simple-monads2",
  "expect": "matched",
  "intent_nl": "Prepend the prefix \"prefix_\" to the input string and return the result.",
  "samples": {
    "schema_version": "1.0",
    "intent_nl": "Prepend the prefix \"prefix_\" to the input string and return the result.",
    "coverage": [
      {
        "id": "ob-happy",
        "kind": "happy_path",
        "description": "Happy path: the corpus example's own data/result pair re-executed through the pinned engine (AD-021 corpus pair).",
        "acceptance": "accepted"
      },
      {
        "id": "ob-variation-1",
        "kind": "custom",
        "description": "Value variation 1: the corpus data shape with leaf scalars replaced from the fixed per-JSON-type substitution table (FR-029).",
        "acceptance": "accepted"
      },
      {
        "id": "ob-variation-2",
        "kind": "custom",
        "description": "Value variation 2: the corpus data shape with leaf scalars replaced from the fixed per-JSON-type substitution table (FR-029).",
        "acceptance": "accepted"
      }
    ],
    "cases": [
      {
        "id": "c-1",
        "input": "value",
        "output": "prefix_value",
        "satisfies": [
          "ob-happy"
        ]
      },
      {
        "id": "c-2",
        "input": "variation-alpha",
        "output": "prefix_variation-alpha",
        "satisfies": [
          "ob-variation-1"
        ]
      },
      {
        "id": "c-3",
        "input": "variation-beta",
        "output": "prefix_variation-beta",
        "satisfies": [
          "ob-variation-2"
        ]
      }
    ],
    "waivers": [],
    "confirmation": {
      "confirmed": true,
      "confirmed_by": "ci",
      "content_fingerprint": "24feb0ca1d68f1780e9c055d6f6551bd78c776cc04d65400a10b3698f15ffbfd"
    }
  },
  "notes": "Synthetic fixture minted from the pinned snapshot docs.examples entry 'ExprSimpleMonads2' (AD-021 / FR-029); seed provenance at evals/seeds/syn-expr-simple-monads2.json.",
  "redacted": false
}
