{
  "schema_version": "1.0",
  "id": "github-head-projection",
  "expect": "matched",
  "intent_nl": "From a GitHub push payload, emit a compact object: a constant event \"push\", repo from repository.full_name, headSha from the after SHA, and pusher from pusher.name.",
  "samples": {
    "schema_version": "1.0",
    "intent_nl": "From a GitHub push payload, emit a compact object: a constant event \"push\", repo from repository.full_name, headSha from the after SHA, and pusher from pusher.name.",
    "coverage": [
      {
        "id": "ob-happy",
        "kind": "happy_path",
        "description": "Head projection.",
        "acceptance": "accepted"
      }
    ],
    "cases": [
      {
        "id": "c",
        "input": {
          "ref": "refs/heads/main",
          "before": "9d8f",
          "after": "1a2b3c4d5e6f",
          "repository": {
            "id": 555000111,
            "name": "payments-api",
            "full_name": "acme/payments-api",
            "default_branch": "main"
          },
          "pusher": {
            "name": "ada",
            "email": "ada@acme.io"
          },
          "sender": {
            "login": "ada",
            "type": "User"
          },
          "commits": [
            {
              "message": "Add idempotency keys to refund endpoint",
              "added": [
                "internal/refund/idempotency.go"
              ],
              "removed": [],
              "modified": [
                "internal/refund/handler.go",
                "internal/refund/handler_test.go"
              ]
            },
            {
              "message": "Fix nil deref when card country is missing",
              "added": [],
              "removed": [],
              "modified": [
                "internal/checkout/validate.go"
              ]
            }
          ]
        },
        "output": {
          "event": "push",
          "repo": "acme/payments-api",
          "headSha": "1a2b3c4d5e6f",
          "pusher": "ada"
        },
        "satisfies": [
          "ob-happy"
        ]
      }
    ],
    "waivers": [],
    "confirmation": {
      "confirmed": true,
      "confirmed_by": "ci",
      "content_fingerprint": "f43bbb7850e88510f0f6c967e970826b2046a9a318520b286c6dd4f92ffd7838"
    }
  },
  "redacted": false
}
