{
  "schema_version": "1.0",
  "id": "syn-join-with-static-no-overrides",
  "expect": "matched",
  "intent_nl": "Return the input object enriched with a default: make sure a key \"a\" exists, filling in the value \"default\" only when the input does not already provide its own \"a\"; every other entry passes through unchanged.",
  "samples": {
    "schema_version": "1.0",
    "intent_nl": "Return the input object enriched with a default: make sure a key \"a\" exists, filling in the value \"default\" only when the input does not already provide its own \"a\"; every other entry passes through unchanged.",
    "coverage": [
      {
        "id": "ob-happy",
        "kind": "happy_path",
        "description": "Happy path: the corpus example's own data/result pair re-executed through the pinned engine (AD-021 corpus pair).",
        "acceptance": "accepted"
      },
      {
        "id": "ob-key-deletion--a",
        "kind": "custom",
        "description": "Key deletion: the corpus data with root key \"a\" removed (OQ-026b).",
        "acceptance": "accepted"
      },
      {
        "id": "ob-key-deletion--c",
        "kind": "custom",
        "description": "Key deletion: the corpus data with root key \"c\" removed (OQ-026b).",
        "acceptance": "accepted"
      }
    ],
    "cases": [
      {
        "id": "c-1",
        "input": {
          "a": "b",
          "c": "d"
        },
        "output": {
          "a": "b",
          "c": "d"
        },
        "satisfies": [
          "ob-happy"
        ]
      },
      {
        "id": "c-2",
        "input": {
          "c": "d"
        },
        "output": {
          "a": "default",
          "c": "d"
        },
        "satisfies": [
          "ob-key-deletion--a"
        ]
      },
      {
        "id": "c-3",
        "input": {
          "a": "b"
        },
        "output": {
          "a": "b"
        },
        "satisfies": [
          "ob-key-deletion--c"
        ]
      }
    ],
    "waivers": [],
    "confirmation": {
      "confirmed": true,
      "confirmed_by": "ci",
      "content_fingerprint": "e6c7b2e454b989e1f0fa36007bfea182c8c9e5445dfe8cb913311a5c5ac63012"
    }
  },
  "notes": "Synthetic fixture minted from the pinned snapshot docs.examples entry 'JoinWithStaticNoOverrides' (AD-021 / FR-029); seed provenance at evals/seeds/syn-join-with-static-no-overrides.json.",
  "redacted": false
}
